url,title,added_at,status,scraped_at,note
https://github.com/SWE-agent/mini-swe-agent?ref=ghuntley.com,SWE-agent/mini-swe-agent at ghuntley.com,2026-01-30T19:48:30.363191+00:00,scraped,2026-01-30T19:49:16.089145+00:00,
https://github.com/Laszlobeer/Dungeo_ai,GitHub - Laszlobeer/Dungeo_ai: this is a dungeon ai run locally that use your llm,2026-01-30T19:48:30.364790+00:00,scraped,2026-01-30T20:28:03.164163+00:00,
https://www.praf.me/ai-coding,An unusual consequence of AI coding - Praful,2026-01-30T19:48:30.365545+00:00,scraped,2026-01-30T20:35:04.491746+00:00,
https://www.reddit.com/r/AI_Agents/comments/1glzob6/tutorial_on_building_agent_with_memory_using_letta/,Tutorial on building agent with memory using Letta : r/AI_Agents,2026-01-30T19:48:30.366163+00:00,scraped,2026-01-30T20:35:31.943205+00:00,
https://www.youtube.com/live/romFuksqnqg,Riley Brown Turned Coding Into a Video Game - YouTube,2026-01-30T19:48:30.366757+00:00,skipped: Matches skip pattern: ^https?://(www\.)?youtube\.com,,
https://github.com/nicobailon/pi-rewind-hook,GitHub - nicobailon/pi-rewind-hook: Pi agent hook for rewinding file changes during coding sessions,2026-01-30T19:48:30.367350+00:00,scraped,2026-01-30T20:36:05.364372+00:00,
https://www.reddit.com/r/ClaudeAI/comments/1qbkk1n/the_complete_guide_to_claude_code_global_claudemd/?share_id=RF0iS7Xfo9p5WRxYAE_vF&utm_medium=ios_app&utm_name=ioscss&utm_source=share&utm_term=1,"The Complete Guide to Claude Code: Global CLAUDE.md, MCP Servers, Commands, and Why Single-Purpose Chats Matter : r/ClaudeAI",2026-01-30T19:48:30.368670+00:00,scraped,2026-01-30T20:36:40.595497+00:00,
https://x.com/kimmonismus/status/2016250861710901372,"Chubby♨️ on X: ""Xiaomi has now a factory that: - makes 1 phone per second - has no production workers and operates in the dark - is fully automated Absolutely insane. https://t.co/Fu8clO3uoh"" / X",2026-01-30T19:48:30.370120+00:00,skipped: Matches skip pattern: ^https?://(www\.)?x\.com,,
https://x.com/factoryai/status/2015889094296142043,"Factory on X: ""Announcing Signals, our work toward a self-improving software development agent."" / X",2026-01-30T19:48:30.378459+00:00,skipped: Matches skip pattern: ^https?://(www\.)?x\.com,,
https://docs.browser-use.com/customize/integrations/mcp-server,MCP Server - Browser Use,2026-01-30T19:48:30.380764+00:00,scraped,2026-01-30T20:37:08.198957+00:00,
https://www.youtube.com/watch?v=vvXC7sqso4w,"How and Why I Built PAI, with Nathan Labenz - YouTube",2026-01-30T19:48:30.382076+00:00,skipped: Matches skip pattern: ^https?://(www\.)?youtube\.com,,
https://github.com/mpfaffenberger/code_puppy/,mpfaffenberger/code_puppy: Agentic AI for writing code,2026-01-30T19:48:30.383349+00:00,scraped,2026-01-30T20:37:37.494964+00:00,
https://github.com/HyperPotatoNeo/RSA,HyperPotatoNeo/RSA,2026-01-30T19:48:30.386058+00:00,scraped,2026-01-30T20:38:06.917581+00:00,
https://arxiv.org/html/2509.26626v1,Recursive Self-Aggregation Unlocks Deep Thinking in Large Language Models,2026-01-30T19:48:30.387395+00:00,scraped,2026-01-30T20:38:51.502902+00:00,
https://openreview.net/forum?id=5Xc1ecxO1h,Tree of Thoughts: Deliberate Problem Solving with Large Language Models | OpenReview,2026-01-30T19:48:30.388809+00:00,scraped,2026-01-30T20:39:18.926172+00:00,
https://arxiv.org/abs/2501.19393,[2501.19393] s1: Simple test-time scaling,2026-01-30T19:48:30.390200+00:00,scraped,2026-01-30T20:39:55.007041+00:00,
https://arxiv.org/abs/2501.09891,[2501.09891] Evolving Deeper LLM Thinking,2026-01-30T19:48:30.394586+00:00,scraped,2026-01-30T20:40:22.084968+00:00,
https://github.com/Schniz/fnm,"Schniz/fnm: 🚀 Fast and simple Node.js version manager, built in Rust",2026-01-30T19:48:30.396094+00:00,scraped,2026-01-30T20:40:50.680216+00:00,
https://moonrepo.dev/proto,proto - A multi-language version manager | moonrepo,2026-01-30T19:48:30.397660+00:00,scraped,2026-01-30T20:41:18.453535+00:00,
https://github.com/marcosomma/orka-reasoning,Orka Reasoning,2026-01-31T23:49:43.317841+00:00,failed: exit code 1,,
https://research.google/blog/towards-a-science-of-scaling-agent-systems-when-and-why-agent-systems-work/,Towards A Science Of Scaling Agent Systems When And Why Agent Systems Work,2026-02-02T22:52:26.797442+00:00,scraped,2026-02-11T09:49:31.088228+00:00,
https://github.com/astrskai/astrsk,astrskai/astrsk: Pushing the boundaries of AI storytelling,2026-02-11T09:46:12.641128+00:00,scraped,2026-02-11T09:50:39.045488+00:00,auto-queued from dumps triage 2026-02-11
https://github.com/Lanerra/saga,"Lanerra/saga: Autonomous, agentic, creative story writing system that incorporates stored embeddings and Knowledge Graphs.",2026-02-11T09:46:12.641128+00:00,scraped,2026-02-11T09:51:43.715739+00:00,auto-queued from dumps triage 2026-02-11
https://github.com/vegu-ai/talemate,"vegu-ai/talemate: Roleplay with AI with a focus on strong narration, consistent world and game state tracking.",2026-02-11T09:46:12.641128+00:00,scraped,2026-02-11T09:53:02.649679+00:00,auto-queued from dumps triage 2026-02-11
https://github.com/Mirrowel/LLM-API-Key-Proxy,"Mirrowel/LLM-API-Key-Proxy: Universal LLM Gateway: One API, every LLM. OpenAI/Anthropic-compatible endpoints with multi-provider translation and intelligent load-balancing.",2026-02-11T09:46:12.641128+00:00,scraped,2026-02-11T09:54:36.848354+00:00,auto-queued from dumps triage 2026-02-11
https://github.com/newjordan/CrabCrust,newjordan/CrabCrust: Your CLI - Your Party,2026-02-11T09:46:12.641128+00:00,scraped,2026-02-11T09:55:41.570775+00:00,auto-queued from dumps triage 2026-02-11
https://crates.io/crates/dotmax,dotmax - crates.io: Rust Package Registry,2026-02-11T09:46:12.641128+00:00,failed: exit code 1,,auto-queued from dumps triage 2026-02-11
https://docs.sillytavern.app/usage/core-concepts/worldinfo/,World Info | docs.ST.app,2026-02-11T09:46:12.641128+00:00,scraped,2026-02-11T09:57:11.710563+00:00,auto-queued from dumps triage 2026-02-11
https://docs.chub.ai/docs/advanced-setups/lorebooks,Lorebooks | Chub AI Guide,2026-02-11T09:46:12.641128+00:00,scraped,2026-02-11T09:58:20.849459+00:00,auto-queued from dumps triage 2026-02-11
https://huggingface.co/zai-org/GLM-4.6V,zai-org/GLM-4.6V · Hugging Face,2026-02-11T09:46:12.641128+00:00,scraped,2026-02-11T09:59:32.046708+00:00,auto-queued from dumps triage 2026-02-11
https://github.com/badlogic/pi-mono/pull/903/files,Add support for intercepting bash by mitsuhiko · Pull Request #903 · badlogic/pi-mono,2026-02-11T09:46:12.641128+00:00,scraped,2026-02-11T10:00:33.863063+00:00,auto-queued from dumps triage 2026-02-11
https://github.com/Piebald-AI/tweakcc/issues,Issues · Piebald-AI/tweakcc,2026-02-11T09:46:12.641128+00:00,scraped,2026-02-11T10:01:41.530747+00:00,auto-queued from dumps triage 2026-02-11
https://devenv.sh/,"Fast, Declarative, Reproducible, and Composable Developer Environments - devenv",2026-02-11T09:46:12.641128+00:00,scraped,2026-02-11T10:03:21.257988+00:00,auto-queued from dumps triage 2026-02-11
https://github.com/cachix/devenv,"cachix/devenv: Fast, Declarative, Reproducible, and Composable Developer Environments using Nix",2026-02-11T09:46:12.641128+00:00,scraped,2026-02-11T10:04:33.958774+00:00,auto-queued from dumps triage 2026-02-11
https://orbstack.dev/pricing,Pricing · OrbStack,2026-02-11T09:46:12.641128+00:00,scraped,2026-02-11T10:06:08.042953+00:00,auto-queued from dumps triage 2026-02-11
https://github.com/Lassulus/wrappers,Lassulus/wrappers: A Nix library to create wrapped executables via the module system,2026-02-11T09:46:12.641128+00:00,scraped,2026-02-11T10:07:20.356572+00:00,auto-queued from dumps triage 2026-02-11
https://docs.sillytavern.app/usage/core-concepts/chatfilemanagement/,Chat File Management | docs.ST.app,2026-02-11T09:46:12.641128+00:00,scraped,2026-02-11T10:08:31.927177+00:00,auto-queued from dumps triage 2026-02-11
https://github.com/disler/claude-code-hooks-multi-agent-observability,disler/claude-code-hooks-multi-agent-observability: Real-time monitoring for Claude Code agents through simple hook event tracking.,2026-02-11T09:46:12.641128+00:00,scraped,2026-02-11T10:10:02.072743+00:00,auto-queued from dumps triage 2026-02-11
https://github.com/babybirdprd/grits,babybirdprd/grits,2026-02-11T09:46:12.641128+00:00,scraped,2026-02-11T10:11:19.417754+00:00,auto-queued from dumps triage 2026-02-11
https://arxiv.org/html/2506.16406,Drag-and-Drop LLMs: Zero-Shot Prompt-to-Weights,2026-02-11T09:46:12.641128+00:00,scraped,2026-02-11T10:13:24.926812+00:00,auto-queued from dumps triage 2026-02-11
https://github.com/numman-ali/openskills,numman-ali/openskills: Universal skills loader for AI coding agents - npm i -g openskills,2026-02-11T09:46:12.641128+00:00,scraped,2026-02-11T10:14:27.142567+00:00,auto-queued from dumps triage 2026-02-11
https://brianhorakh.medium.com/sleep-hacking-with-claude-f3badde6d81d,Sleep hacking with Claude Pro. TLDR - The problem: Claude 5 Hour Usage… | by Brian Horakh | Medium,2026-02-11T09:46:12.641128+00:00,failed: exit code 1,,auto-queued from dumps triage 2026-02-11
https://github.com/coleam00/Archon,coleam00/Archon: Beta release of Archon OS - the knowledge and task management backbone for AI coding assistants.,2026-02-11T09:46:12.641128+00:00,scraped,2026-02-11T10:15:45.263945+00:00,auto-queued from dumps triage 2026-02-11
https://github.com/NoeFabris/opencode-antigravity-auth,NoeFabris/opencode-antigravity-auth: Enable Opencode to authenticate against Antigravity (Google's IDE) via OAuth so you can use Antigravity rate limits and access models like gemini-3-pro and claude-opus-4-5-thinking with your Google credentials.,2026-02-11T09:46:12.641128+00:00,scraped,2026-02-11T10:17:14.337808+00:00,auto-queued from dumps triage 2026-02-11
https://github.com/badlogic/pi-mono/issues/104,ccusage compatibility for session logs · Issue #104 · badlogic/pi-mono,2026-02-11T09:46:12.641128+00:00,failed: exit code 1,,auto-queued from dumps triage 2026-02-11
https://github.com/badlogic/pi-mono/pull/538#issuecomment-3720734306,fix(tui): handle batched key release events over SSH by crcatala · Pull Request #538 · badlogic/pi-mono,2026-02-11T09:46:12.641128+00:00,scraped,2026-02-11T10:18:23.627163+00:00,auto-queued from dumps triage 2026-02-11
https://github.com/badlogic,badlogic (Mario Zechner),2026-02-11T09:46:12.641128+00:00,scraped,2026-02-11T10:19:17.139025+00:00,auto-queued from dumps triage 2026-02-11
https://mariozechner.at/,{ Mario Zechner },2026-02-11T09:46:12.641128+00:00,scraped,2026-02-11T10:20:20.488111+00:00,auto-queued from dumps triage 2026-02-11
https://mariozechner.at/posts/2025-10-05-jailjs/,Infinite Footguns: Writing a JavaScript Interpreter in JavaScript,2026-02-11T09:46:12.641128+00:00,scraped,2026-02-11T10:21:48.973590+00:00,auto-queued from dumps triage 2026-02-11
https://mariozechner.at/posts/2025-08-06-cc-antidebug/,Patching Claude Code for debugging and /cost support for Max users,2026-02-11T09:46:12.641128+00:00,scraped,2026-02-11T10:23:21.265412+00:00,auto-queued from dumps triage 2026-02-11
https://mariozechner.at/posts/2025-12-22-year-in-review-2025/,Year in Review 2025,2026-02-11T09:46:12.641128+00:00,scraped,2026-02-11T10:25:26.923891+00:00,auto-queued from dumps triage 2026-02-11
https://mariozechner.at/posts/2025-11-30-pi-coding-agent/,What I learned building an opinionated and minimal coding agent,2026-02-11T09:46:12.641128+00:00,scraped,2026-02-11T10:28:50.568655+00:00,auto-queued from dumps triage 2026-02-11
https://mariozechner.at/posts/2025-11-22-armin-is-wrong/,Armin is wrong and here's why,2026-02-11T09:46:12.641128+00:00,scraped,2026-02-11T10:30:25.264305+00:00,auto-queued from dumps triage 2026-02-11
https://lucumr.pocoo.org/2025/11/22/llm-apis/,LLM APIs are a Synchronization Problem | Armin Ronacher's Thoughts and Writings,2026-02-11T09:46:12.641128+00:00,scraped,2026-02-11T10:31:27.128572+00:00,auto-queued from dumps triage 2026-02-11
https://github.com/Piebald-AI/claude-code-system-prompts/tree/main,"Piebald-AI/claude-code-system-prompts: All parts of Claude Code's system prompt, 18 builtin tool descriptions, sub agent prompts (Plan/Explore/Task), utility prompts (CLAUDE.md, compact, statusline, magic docs, WebFetch, Bash cmd, security review, agent creation). Updated for each Claude Code version.",2026-02-11T09:46:12.641128+00:00,scraped,2026-02-11T10:32:53.144031+00:00,auto-queued from dumps triage 2026-02-11
https://github.com/Piebald-AI,Piebald,2026-02-11T09:46:12.641128+00:00,scraped,2026-02-11T10:34:49.253712+00:00,auto-queued from dumps triage 2026-02-11
https://news.ycombinator.com/item?id=46568794,Finding and fixing Ghostty's largest memory leak | Hacker News,2026-02-11T09:46:12.641128+00:00,scraped,2026-02-11T10:36:42.463013+00:00,auto-queued from dumps triage 2026-02-11
https://blog.cloudflare.com/code-mode/,Code Mode: the better way to use MCP,2026-02-11T09:46:12.641128+00:00,scraped,2026-02-11T10:38:10.012741+00:00,auto-queued from dumps triage 2026-02-11
https://github.com/OlaProeis/Ferrite,"OlaProeis/Ferrite: A fast, lightweight text editor for Markdown, JSON, YAML, and TOML files. Built with Rust and egui for a native, responsive experience.",2026-02-11T09:46:12.641128+00:00,scraped,2026-02-11T10:40:24.304323+00:00,auto-queued from dumps triage 2026-02-11
https://github.com/badrisnarayanan/antigravity-claude-proxy,"badrisnarayanan/antigravity-claude-proxy: Proxy that exposes Antigravity provided claude / gemini models, so we can use them in Claude Code",2026-02-11T09:46:12.641128+00:00,scraped,2026-02-11T10:41:27.609124+00:00,auto-queued from dumps triage 2026-02-11
https://github.com/badlogic/pi-mono/tree/main/packages/coding-agent#philosophy,pi-mono/packages/coding-agent at main · badlogic/pi-mono,2026-02-11T09:46:12.641128+00:00,scraped,2026-02-11T10:43:20.692777+00:00,auto-queued from dumps triage 2026-02-11
https://github.com/memgrafter/flatagents,"memgrafter/flatagents: Flat, declarative agents and state machines for orchestrating LLMs.",2026-02-11T09:46:12.641128+00:00,scraped,2026-02-11T10:44:33.441083+00:00,auto-queued from dumps triage 2026-02-11
https://github.com/memgrafter/flatagents/commit/00d2ca6257ad529b2f5a0b6f8d759788fa1a44c2#diff-c14d0436e722e453e95d3602f7e37ea97c05e32f03cea34681760a69fcf7a100,"painful version bump, i can really skip examples... · memgrafter/flatagents@00d2ca6",2026-02-11T09:46:12.641128+00:00,scraped,2026-02-11T10:45:26.657285+00:00,auto-queued from dumps triage 2026-02-11
https://github.com/memgrafter/flatagents/tree/main,"memgrafter/flatagents: Flat, declarative agents and state machines for orchestrating LLMs.",2026-02-11T09:46:12.641128+00:00,scraped,2026-02-11T10:46:36.775647+00:00,auto-queued from dumps triage 2026-02-11
https://github.com/vercel-labs/agent-browser,vercel-labs/agent-browser: Browser automation CLI for AI agents,2026-02-11T09:46:12.641128+00:00,scraped,2026-02-11T10:47:54.365937+00:00,auto-queued from dumps triage 2026-02-11
https://docs.parallel.ai/task-api/task-quickstart,Task API Quickstart - Parallel,2026-02-11T09:46:12.641128+00:00,pending,,auto-queued from dumps triage 2026-02-11
https://linearb.io/dev-interrupted/podcast/inventing-the-ralph-wiggum-loop,Inventing the Ralph Wiggum Loop | Dev Interrupted Powered by LinearB,2026-02-11T09:46:12.641128+00:00,pending,,auto-queued from dumps triage 2026-02-11
https://github.com/steveyegge/beads/blob/main/docs/UNINSTALLING.md,beads/docs/UNINSTALLING.md at main · steveyegge/beads,2026-02-11T09:46:12.641128+00:00,pending,,auto-queued from dumps triage 2026-02-11
https://steve-yegge.medium.com/gas-town-emergency-user-manual-cf0e4556d74b,"Gas Town Emergency User Manual. It’s been a busy 12 days since I… | by Steve Yegge | Jan, 2026 | Medium",2026-02-11T09:46:12.641128+00:00,pending,,auto-queued from dumps triage 2026-02-11
https://github.com/robbintt/flatagents/blob/a7cc6aa0109fae47beac7d822f478d3a69366fcf/SDK_COMMON_SPEC_PLAN.md,flatagents/SDK_COMMON_SPEC_PLAN.md at a7cc6aa0109fae47beac7d822f478d3a69366fcf · robbintt/flatagents,2026-02-11T09:46:12.641128+00:00,pending,,auto-queued from dumps triage 2026-02-11
https://github.com/1yefuwang1/vectorlite,"1yefuwang1/vectorlite: Fast, SQL powered, in-process vector search for any language with an SQLite driver",2026-02-11T09:46:12.641128+00:00,pending,,auto-queued from dumps triage 2026-02-11
https://dev.to/yefuwang/introducing-vectorlite-a-fast-and-tunable-vector-search-extension-for-sqlite-4dcl,Introducing vectorlite: A Fast and Tunable Vector Search Extension for SQLite - DEV Community,2026-02-11T09:46:12.641128+00:00,pending,,auto-queued from dumps triage 2026-02-11
https://docs.trynia.ai/local-sync,Local Sync - Nia AI Documentation,2026-02-11T09:46:12.641128+00:00,pending,,auto-queued from dumps triage 2026-02-11
https://github.com/ghostty-org/ghostty,"ghostty-org/ghostty: 👻 Ghostty is a fast, feature-rich, and cross-platform terminal emulator that uses platform-native UI and GPU acceleration.",2026-02-11T09:46:12.641128+00:00,pending,,auto-queued from dumps triage 2026-02-11
https://lobste.rs/active,Active Discussions | Lobsters,2026-02-11T09:46:12.641128+00:00,pending,,auto-queued from dumps triage 2026-02-11
https://lobste.rs/s/yegxsx/waiting_for_dawn_search_search_index,"Waiting for dawn in search: Search index, Google rulings and impact on Kagi | Lobsters",2026-02-11T09:46:12.641128+00:00,pending,,auto-queued from dumps triage 2026-02-11
https://blog.kagi.com/waiting-dawn-search,"Waiting for dawn in search: Search index, Google rulings and impact on Kagi | Kagi Blog",2026-02-11T09:46:12.641128+00:00,pending,,auto-queued from dumps triage 2026-02-11
https://lobste.rs/s/ijyacx/overrun_with_ai_slop_curl_scraps_bug,"Overrun with AI slop, cURL scraps bug bounties to ensure ""intact mental health"" | Lobsters",2026-02-11T09:46:12.641128+00:00,pending,,auto-queued from dumps triage 2026-02-11
https://lobste.rs/s/pb4kco/don_t_trip_wire_yourself_testing_error,Don't Trip[wire] Yourself: Testing Error Recovery in Zig | Lobsters,2026-02-11T09:46:12.641128+00:00,pending,,auto-queued from dumps triage 2026-02-11
https://github.com/badlogic/pi-mono/tree/main/packages/mom,pi-mono/packages/mom at main · badlogic/pi-mono,2026-02-11T09:46:12.641128+00:00,pending,,auto-queued from dumps triage 2026-02-11
https://lobste.rs/s/kvvxkl/enclosure_feedback_loop_how_llms,"The Enclosure feedback loop, or how LLMs sabotage existing programming practices by privatizing a public good | Lobsters",2026-02-11T09:46:12.641128+00:00,pending,,auto-queued from dumps triage 2026-02-11
https://lobste.rs/s/sbtjef/spreadsheets_vi_json,spreadsheets + vi + json | Lobsters,2026-02-11T09:46:12.641128+00:00,pending,,auto-queued from dumps triage 2026-02-11
https://lobste.rs/s/yryapx/indieweb_small_web,The IndieWeb and Small web | Lobsters,2026-02-11T09:46:12.641128+00:00,pending,,auto-queued from dumps triage 2026-02-11
https://lobste.rs/s/cw6f2s/ai_tribalism,AI tribalism | Lobsters,2026-02-11T09:46:12.641128+00:00,pending,,auto-queued from dumps triage 2026-02-11
https://github.com/agnt-gg/agnt,agnt-gg/agnt: The place for AGNT,2026-02-11T09:46:12.641128+00:00,pending,,auto-queued from dumps triage 2026-02-11
https://arxiv.org/abs/2601.16486,[2601.16486] Timely Machine: Awareness of Time Makes Test-Time Scaling Agentic,2026-02-11T09:46:12.641128+00:00,pending,,auto-queued from dumps triage 2026-02-11
https://arxiv.org/abs/2510.00501,[2510.00501] CodeChemist: Functional Knowledge Transfer for Low-Resource Code Generation via Test-Time Scaling,2026-02-11T09:46:12.641128+00:00,pending,,auto-queued from dumps triage 2026-02-11
https://arxiv.org/abs/2510.13940,[2510.13940] Less is More: Improving LLM Reasoning with Minimal Test-Time Intervention,2026-02-11T09:46:12.641128+00:00,pending,,auto-queued from dumps triage 2026-02-11
https://github.com/Soleone/pi-tasks,"Soleone/pi-tasks: An extension for pi coding agent to manage tasks, via beads or alternative task backends.",2026-02-11T09:46:12.641128+00:00,pending,,auto-queued from dumps triage 2026-02-11
https://github.com/robbintt?tab=repositories&q=cbt&type=&language=&sort=,Your Repositories,2026-02-11T09:46:12.641128+00:00,pending,,auto-queued from dumps triage 2026-02-11
https://github.com/memgrafter/pi-pkm-mode-extension,memgrafter/pi-pkm-mode-extension: Personal knowledge management in pi.,2026-02-11T09:46:12.641128+00:00,pending,,auto-queued from dumps triage 2026-02-11
https://docs.digitalocean.com/platform/billing/promo-codes/,Promo Codes | DigitalOcean Documentation,2026-02-11T09:46:12.641128+00:00,pending,,auto-queued from dumps triage 2026-02-11
https://docs.digitalocean.com/platform/billing/,Billing | DigitalOcean Documentation,2026-02-11T09:46:12.641128+00:00,pending,,auto-queued from dumps triage 2026-02-11
https://github.com/nicobailon/pi-subagents,"nicobailon/pi-subagents: Pi extension for async subagent delegation with truncation, artifacts, and session sharing",2026-02-11T09:46:12.641128+00:00,pending,,auto-queued from dumps triage 2026-02-11
https://github.com/lsj5031/PiSwarm,lsj5031/PiSwarm,2026-02-11T09:46:12.641128+00:00,pending,,auto-queued from dumps triage 2026-02-11
https://github.com/robbintt/docs-for-llms/blob/main/documentation-best-practices.md,docs-for-llms/documentation-best-practices.md at main · robbintt/docs-for-llms,2026-02-11T09:46:12.641128+00:00,pending,,auto-queued from dumps triage 2026-02-11
https://github.com/memgrafter/analysis/blob/main/analysis_outputs/research_index.sqlite,analysis/analysis_outputs/research_index.sqlite at main · memgrafter/analysis,2026-02-11T09:46:12.641128+00:00,pending,,auto-queued from dumps triage 2026-02-11
https://huggingface.co/arcee-ai/Trinity-Large-Preview,arcee-ai/Trinity-Large-Preview · Hugging Face,2026-02-11T09:46:12.641128+00:00,pending,,auto-queued from dumps triage 2026-02-11
https://arxiv.org/abs/2512.20884,[2512.20884] The Silent Scholar Problem: A Probabilistic Framework for Breaking Epistemic Asymmetry in LLM Agents,2026-02-11T09:46:12.641128+00:00,pending,,auto-queued from dumps triage 2026-02-11
https://arxiv.org/abs/2512.19428,[2512.19428] Attention Is Not What You Need,2026-02-11T09:46:12.641128+00:00,pending,,auto-queued from dumps triage 2026-02-11
https://ameer-saleem.medium.com/how-does-multi-head-attention-improve-upon-one-larger-single-head-mechanism-674858597d36,"How does multi-head attention improve upon one larger single-head mechanism? | by AmeerSaleem | Feb, 2026 | Medium",2026-02-11T09:46:12.641128+00:00,pending,,auto-queued from dumps triage 2026-02-11
https://github.com/steveyegge/gastown,steveyegge/gastown: Gas Town - multi-agent workspace manager,2026-02-11T09:46:12.641128+00:00,pending,,auto-queued from dumps triage 2026-02-11
https://github.com/memgrafter/analysis/tree/main/ml_research_analysis,analysis/ml_research_analysis at main · memgrafter/analysis,2026-02-11T09:46:12.641128+00:00,pending,,auto-queued from dumps triage 2026-02-11
https://arxiv.org/abs/2509.20368,[2509.20368] LATTS: Locally Adaptive Test-Time Scaling,2026-02-11T09:46:12.641128+00:00,pending,,auto-queued from dumps triage 2026-02-11
https://arxiv.org/html/2502.16128v1,Heterogeneous Multi-Agent Bandits with Parsimonious Hints,2026-02-11T09:46:12.641128+00:00,pending,,auto-queued from dumps triage 2026-02-11
https://arxiv.org/list/stat.ML/recent,Machine Learning,2026-02-11T09:46:12.641128+00:00,pending,,auto-queued from dumps triage 2026-02-11
https://github.com/badlogic/pi-mono/blob/main/packages/coding-agent/README.md,pi-mono/packages/coding-agent/README.md at main · badlogic/pi-mono,2026-02-11T09:46:12.641128+00:00,pending,,auto-queued from dumps triage 2026-02-11
https://natesnewsletter.substack.com/p/200-lines-of-markdown-just-triggered?r=1z4sm5&utm_campaign=post&utm_medium=web,200 lines of markdown just triggered a $285 billion sell-off — here's what actually broke + what it means for your workflow,2026-02-11T09:46:12.641128+00:00,pending,,auto-queued from dumps triage 2026-02-11
https://techcrunch.com/2026/02/10/former-github-ceo-raises-record-60m-dev-tool-seed-round-at-300m-valuation/,Former GitHub CEO raises record $60M dev tool seed round at $300M valuation | TechCrunch,2026-02-11T09:46:12.641128+00:00,pending,,auto-queued from dumps triage 2026-02-11
https://export.arxiv.org/,arXiv.org e-Print archive,2026-02-11T09:46:12.641128+00:00,pending,,auto-queued from dumps triage 2026-02-11
https://github.com/robbintt/docs-for-llms/tree/main,robbintt/docs-for-llms: Documentation for LLMs to use to build good projects. Token count is managed in each doc.,2026-02-11T09:46:12.641128+00:00,pending,,auto-queued from dumps triage 2026-02-11
https://github.com/wshobson/agents/tree/main/plugins,agents/plugins at main · wshobson/agents,2026-02-11T09:46:12.641128+00:00,pending,,auto-queued from dumps triage 2026-02-11
https://github.com/marcosomma/orka-reasoning/tree/master/docs,orka-reasoning/docs at master · marcosomma/orka-reasoning,2026-02-11T09:46:12.641128+00:00,pending,,auto-queued from dumps triage 2026-02-11
https://github.com/memgrafter/flatagents/tree/main/sdk/examples/anything_agent,flatagents/sdk/examples/anything_agent at main · memgrafter/flatagents,2026-02-11T09:46:12.641128+00:00,pending,,auto-queued from dumps triage 2026-02-11
https://github.com/memgrafter/skills-flatagents/blob/main/website_scraper/website_analysis/2026/2026-01-30_github-mpfaffenbergercode-puppy-agentic-ai-for-writing-code.md,skills-flatagents/website_scraper/website_analysis/2026/2026-01-30_github-mpfaffenbergercode-puppy-agentic-ai-for-writing-code.md at main · memgrafter/skills-flatagents,2026-02-11T09:46:12.641128+00:00,pending,,auto-queued from dumps triage 2026-02-11
